<!ELEMENT werknemers (werknemer)* >
<!ELEMENT werknemer (naam) >
<!ATTLIST werknemer 
	datumindienst CDATA #REQUIRED 
	loon CDATA #REQUIRED >
<!ELEMENT naam (#PCDATA) >
